{
  "$schema": "./program-manifest.schema.json",
  "manifest_version": 1,
  "program_id": "adr011-012",
  "status": "draft-awaiting-ratification",
  "claims": {"tracker_published": false, "implementation_started": false, "evidence_complete": false},
  "authority_catalog": {
    "adrs": ["ADR-011", "ADR-012", "ADR-013", "ADR-014", "ADR-015", "ADR-016"],
    "rulings": ["R1", "R2", "R3", "R4", "R5", "R6", "R7", "R8", "R9", "R10", "R11", "R12", "R13", "R14", "R15", "R16", "R17", "R18", "R19", "R20"]
  },
  "publication": {
    "stage": "bootstrap-and-inventory",
    "publish_now_entry_count": 89,
    "final_entry_count_formula": "93+C+D+T+L+I+P+B",
    "template_state": "not-github-issues",
    "ready_authority": "complete-body-plus-native-blockers",
    "atomic_expansion_protocol": [
      "Commit an exact-revision inventory with stable row identities, owners, sinks, counts, and hashes.",
      "Partition deterministically by replacement owner, old producer, and compatible gate set; record zero-row proofs.",
      "Generate the complete proposed child bodies, blockers, capstone edges, and downstream edge additions.",
      "Obtain a separate user ratification for the concrete numbered expansion.",
      "Create children without readiness labels, make every child natively blocked by its still-open inventory, and add every child to its capstone.",
      "Add capstone and wave blockers to downstream issues before closing the inventory; edges are added before any edge is removed.",
      "Re-fetch bodies, state, labels, comments, and native endpoints; prove row union, uniqueness, acyclicity, and body-edge equality.",
      "Apply readiness only after the audit and append its inventory and graph hashes.",
      "Close the inventory only after all preceding steps pass; on failure leave staged children non-ready."
    ]
  },
  "standing_rules": {
    "public_behavior_book_gate": {
      "enabled": true,
      "bootstrap_ticket_id": "BOOK-PAIR-PROMOTE",
      "explicit_blocked_entry_ids": [
        "#92", "APPLICATION-IDENTITY", "COMPTIME-HOST-TRACER", "DISCOVERY-ENGINE-BASE", "DISCOVERY-TRAIT", "#94",
        "EFFECT-CONTRACT", "#95", "#96", "EFFECT-MIR-PROOF", "CAPABILITY-PROOF-BASE", "HOF-NATIVE-TRACER", "ARGUMENT-PACK", "#97",
        "AROUND-SYNC", "AROUND-RECEIVER", "#98", "#99", "OUTCOME-TEARDOWN-PROOF", "AROUND-ASYNC", "AROUND-NATIVE-CLOSE",
        "#100", "#101", "WIRE-V3-ENVELOPE", "JOURNAL-CORE", "JOURNAL-HARDENING", "#102", "JOURNAL-OPS", "DURABLE-SUPERVISOR",
        "SUPERVISOR-RECOVERY-LIFECYCLE", "JOURNAL-CAPSTONE", "#103", "VERIFIED-ARTIFACT-PERSISTENCE", "#104",
        "TARGET-ADAPTER-SEAM", "TARGET-EXTERN-C", "TARGET-PYTHON", "TARGET-TYPESCRIPT", "TARGET-METADATA", "TARGET-ADMISSION-C",
        "TARGET-ADMISSION-DYNAMIC", "TARGET-ADMISSION-RESTORE", "#105", "#106", "#107", "JSON-SCHEMA-CONSUMER", "#108",
        "LLM-TOOL-CONSUMER", "LSP-HOVER-DIAG", "LSP-COMPLETION-NAV", "LSP-RENAME", "LSP-EXPANSION-MAP", "#109", "#110", "#23"
      ],
      "dependency_mode": "explicit-native-bootstrap-blocker",
      "same_slice_obligations": [
        "Update PublicFeatureManifest.", "Update BookCoverageManifest and owning Book material.",
        "Run the full gate on one immutable candidate pair.", "Attest and promote the new exact pair before the feature ticket closes."
      ],
      "gap_policy": "Every gap is runnable coverage, intrinsically illustrative with reason and authority, a concrete owned implementation or evidence gap, a stale claim to deprecate, remove, or tombstone forward, or an immediate invalid/unclassified failure; a broken current surface retains its status and owner and is never illustrative or relabelled planned.",
      "pair_promotion_protocol": {
        "candidate_identity": "canonical-content-digest", "attestation_identity": "signed-content-digest",
        "storage": "protected-external-coordination-object", "source_manifests_carry_exact_revisions": false,
        "exact_revision_authority": "external-candidate-reports-and-attestation", "transition_identity": "signed-monotone-cas-record",
        "attestation_owns_transition_generation": false, "accepted_pair_pointer": "cas-to-signed-transition",
        "accepted_pair_authority": "selected-signed-transition", "source_refs_are_pair_authority": false,
        "reciprocal_source_pins": false, "rollback": "new-higher-generation-transition-selecting-prior-attestation"
      },
      "status_lifecycle": {
        "ordered_states": ["planned", "experimental", "public", "deprecated", "removed"],
        "bootstrap_source": "mechanically-derived-source-book-release-authority", "backward_demotion": false,
        "ambiguous_status": "blocking-status-audit-gap", "broken_current": "retain-status-and-owner-until-repair-or-forward-removal",
        "material_restart": "new-id-with-old-id-tombstone"
      },
      "identity_migration": {
        "domains": ["feature", "section", "fence"], "prior_identity": "schema-and-content-digest",
        "total_dispositions": "unchanged-replaced-or-removed", "replacement_policy": "injective-unless-explicit-reviewed-merge",
        "tombstones": "required-for-all-three-domains", "negative_mutations": "omission-reuse-split-merge-and-old-coverage-reattachment"
      }
    },
    "native_execution_witness": {
      "enabled": true, "witness_ticket_id": "NATIVE-WITNESS",
      "scope": "Every native claim identifies the exact function, verified artifact, installation and later dispatch event, plus covered fallback or deoptimization."
    }
  },
  "invariants": {
    "expected_entry_count": 89, "final_entry_count_formula": "93+C+D+T+L+I+P+B",
    "initial_frontier": ["AUTHORITY-BASELINE"], "preserved_existing_issues": ["#93"],
    "authority_baseline_ticket": "AUTHORITY-BASELINE",
    "migration_inventory_tickets": ["SEMANTIC-LEGACY-INVENTORY", "ELABORATION-LEGACY-INVENTORY", "TOOLING-EVIDENCE-INVENTORY"],
    "migration_guard_ticket": "MIGRATION-GUARD", "authority_close_ticket": "#90",
    "book_bootstrap_ticket": "BOOK-PAIR-PROMOTE", "program_capstone": "#23",
    "effect_proof_ticket": "EFFECT-MIR-PROOF", "capability_proof_ticket": "CAPABILITY-PROOF-BASE",
    "around_native_close_ticket": "AROUND-NATIVE-CLOSE", "artifact_codec_ticket": "#101",
    "artifact_storage_adapter_ticket": "VERIFIED-ARTIFACT-PERSISTENCE", "wire_v3_ticket": "WIRE-V3-ENVELOPE",
    "journal_core_ticket": "JOURNAL-CORE", "journal_dispatch_ready_ticket": "JOURNAL-HARDENING",
    "journal_ops_ticket": "JOURNAL-OPS", "journal_capstone_ticket": "JOURNAL-CAPSTONE",
    "remote_dispatch_ticket": "#102", "recovery_lifecycle_ticket": "SUPERVISOR-RECOVERY-LIFECYCLE",
    "snapshot_v8_ticket": "#104",
    "stabilized_runtime_predecessors": ["#101", "#102", "#103", "SUPERVISOR-RECOVERY-LIFECYCLE", "VERIFIED-ARTIFACT-PERSISTENCE"],
    "intrinsic_inventory_ticket": "INTRINSIC-INVENTORY", "intrinsic_close_target": "#23", "intrinsic_unrelated_non_blocker": "#110",
    "retry_identity": {
      "recovery_episode_ticket": "#99", "retry_commit_ticket": "#100", "remote_dispatch_ticket": "#102",
      "authority": {"adrs": ["ADR-015"], "rulings": ["R7", "R8", "R9"]},
      "same_recovery_episode": true, "fresh_attempt_id_and_next_on_retry": true,
      "fresh_transfer_and_admission_on_retry": true, "same_transfer_only_for_same_attempt_retransmission": true,
      "prior_escrow_before_retry_commit": "settled-or-atomically-transferred"
    }
  },
  "external_dependencies": [
    {"id": "#22", "role": "Retained legacy program blocker until every obligation has a replacement owner.", "blocked_by": []},
    {"id": "#58", "role": "Pre-existing callable carrier prerequisite; its old #90 gate is replaced by the migration guard.", "blocked_by": ["MIGRATION-GUARD"]}
  ],
  "entries": [
    {"ordinal": 1, "id": "AUTHORITY-BASELINE", "kind": "new-ticket", "disposition": "new", "title": "Commit the authority baseline and exact revision disposition",
      "blocked_by": [], "authority": {"adrs": ["ADR-011", "ADR-012", "ADR-013", "ADR-014", "ADR-015", "ADR-016"], "rulings": ["R14", "R20"]},
      "delivers": "Complete ADR and ruling authority, exact Shape and shape-web revisions, and the paused-E6 disposition without semantic implementation."},
    {"ordinal": 2, "id": "PF-CONTRACT", "kind": "new-ticket", "disposition": "new", "title": "Land the public-feature manifest contract",
      "blocked_by": ["AUTHORITY-BASELINE"], "authority": {"adrs": ["ADR-016"], "rulings": ["R19"]},
      "delivers": "Revision-free schema, prior schema/content identity, total feature-ID migration and tombstones, mechanically derived forward-only status transitions, public-to-planned rejection, no source/counterpart SHA, attestation, or mutable verification fields, validator, and one load-bearing row."},
    {"ordinal": 3, "id": "BOOK-CONTRACT", "kind": "new-ticket", "disposition": "new", "title": "Land the Book coverage manifest contract",
      "blocked_by": ["AUTHORITY-BASELINE", "PF-CONTRACT"], "authority": {"adrs": ["ADR-016"], "rulings": ["R19"]},
      "delivers": "Revision-free schema, prior schema/content identity, total feature/section/fence migration maps and tombstones, bidirectional references, rejection of manifest-local source/counterpart revisions, hashes, attestations, and mutable verification state, validator, and one paired row."},
    {"ordinal": 4, "id": "PF-INVENTORY", "kind": "new-ticket", "disposition": "new", "title": "Inventory every current public feature",
      "blocked_by": ["PF-CONTRACT"], "authority": {"adrs": ["ADR-016"], "rulings": ["R19"]},
      "delivers": "A mechanical candidate-row inventory with stable IDs, source authority, owners, family, count, content hash, and explicit unresolved classification gaps; exact revisions are external, P waves classify status, modes, dimensions, and evidence, and the inventory stays open through expansion."},